### ISSUE TITLE
sfacctd and nfacctd on the same server

### ISSUE THREAD

**Issue by mnanduri** [pmacct/pmacct#324]
I am trying to run nfacctd and sfacctd on the same server, I got nfacctd up and running and receiving IPFIX data from Juniper devices. I am running into issue with sflow. I have an arista device sending sflow data but I dont see it being written to a file. 

Any ideas?

sfacctd.conf:
=========
pcap_interface: eth0
!
debug: true
daemonize: true
logfile: /home/dev/pmacct-1.7.3/sfacctd.log
plugins: print
aggregate: src_host, dst_host, src_port, dst_port, proto, tos, sampling_rate
sfacctd_ip: 192.168.1.157
sfacctd_port: 6343

print_refresh_time: 10
print_history: 5m
print_output: json
print_output_file: /tmp/file-%Y%m%d-%H%M.json
print_history_roundoff: m
print_output_file_append: true

2019-09-30T10:33:46-04:00 DEBUG ( default/core ): readv5CountersSample(): element tag 0:2.
2019-09-30T10:33:46-04:00 DEBUG ( default/core ): readv5CountersSample(): element tag 0:1.
2019-09-30T10:33:51-04:00 INFO ( default_print/print ): *** Purging cache - START (PID: 27181) ***
2019-09-30T10:33:51-04:00 INFO ( default_print/print ): *** Purging cache - END (PID: 27181, QN: 0/0, ET: X) ***
2019-09-30T10:33:53-04:00 DEBUG ( default/core ): Received sFlow packet from [192.168.1.144:60848] version [5] seqno [15623]
2019-09-30T10:33:53-04:00 DEBUG ( default/core ): readv5CountersSample(): element tag 0:2.
2019-09-30T10:33:53-04:00 DEBUG ( default/core ): readv5CountersSample(): element tag 0:1.
2019-09-30T10:33:55-04:00 DEBUG ( default/core ): Received sFlow packet from [192.168.1.144:60848] version [5] seqno [15624]
2019-09-30T10:33:55-04:00 DEBUG ( default/core ): readv5CountersSample(): element tag 0:2.
2019-09-30T10:33:55-04:00 DEBUG ( default/core ): readv5CountersSample(): element tag 0:1.
2019-09-30T10:34:01-04:00 INFO ( default_print/print ): *** Purging cache - START (PID: 27182) ***
2019-09-30T10:34:01-04:00 INFO ( default_print/print ): *** Purging cache - END (PID: 27182, QN: 0/0, ET: X) ***

root@sandbox:/home/dev/pmacct-1.7.3# tcpdump -i eth0 port 6343
tcpdump: verbose output suppressed, use -v or -vv for full protocol decode
listening on eth0, link-type EN10MB (Ethernet), capture size 262144 bytes
10:37:46.433304 IP 192.168.1.144.60848 > 192.168.1.157.6343: sFlowv5, IPv4 agent 192.168.1.144, agent-id 0, length 213
10:37:53.433458 IP 192.168.1.144.60848 > 192.168.1.157.6343: sFlowv5, IPv4 agent 192.168.1.144, agent-id 0, length 213
10:37:55.433772 IP 192.168.1.144.60848 > 192.168.1.157.6343: sFlowv5, IPv4 agent 192.168.1.144, agent-id 0, length 213

**Comment by AnanthGopal** [comment]
Hi @mnanduri I got error when configure the nfacctd  with rabbitmq. Can you have any idea to resolve below issue ? 

https://github.com/pmacct/pmacct/issues/325

**Comment by paololucente** [comment]
Hi @mnanduri , as you may spot from the debug messages of sfacctd, the sFlow packets are only including interfaces counters, no flow data: you can see that only readv5CountersSample is called whereas readv5FlowSample is never invoked. You should enable your Arista device to send sFlow flow samples (i can't help you with that, i am not familiar with Arista). Paolo

**Comment by mnanduri** [comment]
Thank you for the quick response. I have the config but could be a
limitation on vEOS. Let me check on that.

Cheers,
-Mohan

**Comment by mnanduri** [comment]
Looks like an issue with vEOS. I was able to send flows from a vMX device. Going to close this. Thanks for your help.
