### ISSUE TITLE
Question | Working of PMACCT

### ISSUE THREAD

**Issue by smit1682** [pmacct/pmacct#795]
Hello, @paololucente I am using your wonderful tool for network insights, I need to understand the underlying mechanism, to know how this works. 
 For example, I have one utility that sends flow to my PMACCT collector.  
 I am sending 1000 packets, each packet contains 8 flows, so a total of 8000 flows are going to PMACCT as input.
 
 as you can see my nfacctd.conf file i have set print_refresh_time[NetFlow]: 300 so after 5 min i am receiving 8000 parsed flow events. (input 8000 flow, output 8000 flow)
 
 So my questions are below:
 1)  Is there any aggregation happening between those 5 min ?
 2) If Yes, On what key aggregations are happening? 
 3) I was expecting that it would reduce total events by submerging(aggregating) the same source IPs, and destination Ips, am i thinking the right way?
 4) Please let me know if there is any key to enable aggregation.
 
 Thank you 

**Version**
response from: nfacctd -V
```
NetFlow Accounting Daemon, nfacctd 1.7.9-git [20231117-2 (d26bfa11)]

Arguments:
 --prefix=/usr/local/pmacct' '--enable-jansson' '--enable-zmq' '--enable-ndpi' 'PKG_CONFIG_PATH=/usr/local/pmacct/lib/pkgconfig' 'NDPI_CFLAGS=-I/usr/local/pmacct/include/ndpi' 'NDPI_LIBS=-L/usr/local/pmacct/lib/.libs -lndpi' 'JANSSON_LIBS=-L/usr/local/pmacct/lib -ljansson' 'JANSSON_CFLAGS=-I/usr/local/pmacct/include' 'ZMQ_LIBS=-L/usr/local/pmacct/lib -lzmq' 'ZMQ_CFLAGS=-I/usr/local/pmacct/include' '--enable-l2' '--enable-traffic-bins' '--enable-bgp-bins' '--enable-bmp-bins' '--enable-st-bins'

Libs:
cdada 0.5.0
libpcap version 1.10.1 (with TPACKET_V3)
jansson 2.14
ZeroMQ 4.3.5
nDPI 4.6.0-4029-683cdf2d

Plugins:
memory
print
nfprobe
sfprobe
tee

System:
Linux 6.5.0-41-generic #41~22.04.2-Ubuntu SMP PREEMPT_DYNAMIC Mon Jun  3 11:32:55 UTC 2 x86_64

Compiler:
gcc 9.4.0
```

nfacctd.conf file 

```
plugins: print[NetFlow]
nfacctd_port:2055
zmq_address: tcp://localhost:9449
logfile: /home/smit/8/Motadata/motadata/logs/flow/NetFlow_1721130743187.log
loglevel: 7
snaplen: 65535
use_ip_next_hop: true
classifier_num_roots: 10240
aggregate[NetFlow]: export_proto_seqno, src_host, dst_host, peer_src_ip, peer_dst_ip, in_iface, out_iface, src_port, dst_port, proto, sampling_rate, flows, tcpflags, tag, export_proto_version, tos, class, timestamp_start, timestamp_end, src_as, dst_as, peer_dst_as
print_output_file[NetFlow]:NetFlow
print_output[NetFlow]: json
print_history[NetFlow]: 5m
print_history_roundoff[NetFlow]: m
print_refresh_time[NetFlow]: 300
plugin_pipe_zmq: true
print_num_protos: true
pre_tag_map: /home/smit/8/Motadata/motadata/tag.rule
print_cache_entries[NetFlow]: 16411
tmp_asa_bi_flow : true
nfacctd_net : netflow
nfacctd_as : netflow
nfacctd_peer_as : true
nfacctd_time_new: true
```

**Comment by paololucente** [comment]
Hi Smit ( @smit1682 ) ,

The configuration key that governs aggregation is `aggregate`. pmacct will naturally aggregate data but the value you specified for `aggregate` effectively makes it total de-aggregate. As a test, please simply remove `timestamp_start, timestamp_end`; then further refine and test as satisfactory for you is the achieved aggregation.

Paolo

**Comment by smit1682** [comment]
@paololucente  thank you for the response, 

I am facing a new problem,
I am forwarding sflow in sfacctd collector but flow is not getting parsed, I have sent you mail attached with pcap file and logs.(email.id: smit.prajapati@motadata.com)

Just for ref. While I try to see flow with tcpdump I am receiving the below output

17:16:43.436975 IP 10.3.1.11.41909 > DU-AIOps.6343: sFlow version 327682 packet not supported
17:16:43.437280 IP 10.3.1.11.41909 > DU-AIOps.6343: sFlow version 327682 packet not supported
17:16:43.440458 IP 10.103.1.11.33059 > DU-AIOps.6343: sFlow version 327682 packet not supported
17:16:43.444459 IP 10.3.1.11.41909 > DU-AIOps.6343: sFlow version 327681 packet not supported
17:16:43.444583 IP 10.3.1.11.41909 > DU-AIOps.6343: sFlow version 327681 packet not supported

When I use top command, I see that the core process of sfacct is working and consuming CPU and memory.

The version is the same as above.

**Comment by smit1682** [comment]
hello paolo,

I have made changes as you suggested, removing `timestamp_start, timestamp_end` in nfacctd.conf.

but still, I am receiving the same thing.(input and and output flow count is same no aggregation).

updated conf file
```
plugins: print[NetFlow]
nfacctd_port:2055
zmq_address: tcp://localhost:9449
logfile: /home/smit/8/Motadata/motadata/logs/flow/NetFlow_1723619928448.log
loglevel: 7
snaplen: 65535
use_ip_next_hop: true
classifier_num_roots: 10240
aggregate[NetFlow]: export_proto_seqno, src_host, dst_host, peer_src_ip, peer_dst_ip, in_iface, out_iface, src_port, dst_port, proto, sampling_rate, flows, tcpflags, tag, export_proto_version, tos, class
print_output_file[NetFlow]:NetFlow
print_output[NetFlow]: json
print_history[NetFlow]: 2m
print_history_roundoff[NetFlow]: m
print_refresh_time[NetFlow]: 60
plugin_pipe_zmq: true
print_num_protos: true
pre_tag_map: /home/smit/8/Motadata/motadata/tag.rule
print_cache_entries[NetFlow]: 16411
nfacctd_time_new: true
```
I am sending 1000 flows and receiving 1000 flows, below are the parsed flow for reference:

```
14-August-2024 12 12:19:01.253 pm INFO {"tag":0,"class":"unknown","peer_ip_src":"127.0.0.1","peer_ip_dst":"","iface_in":0,"iface_out":0,"ip_src":"1.1.1.1","ip_dst":"2.2.2.2","port_src":40,"port_dst":80,"tcp_flags":"0","ip_proto":"6","tos":0,"sampling_rate":0,"export_proto_seqno":1,"export_proto_version":5,"flows":1,"packets":957,"bytes":495,"flow_type":"NetFlow","event.volume.bytes":373}
14-August-2024 12 12:19:01.355 pm INFO {"tag":0,"class":"unknown","peer_ip_src":"127.0.0.1","peer_ip_dst":"","iface_in":0,"iface_out":0,"ip_src":"1.1.1.1","ip_dst":"2.2.2.2","port_src":12001,"port_dst":8080,"tcp_flags":"0","ip_proto":"6","tos":0,"sampling_rate":0,"export_proto_seqno":1,"export_proto_version":5,"flows":1,"packets":54,"bytes":883,"flow_type":"NetFlow","event.volume.bytes":377}
14-August-2024 12 12:19:01.356 pm INFO {"tag":0,"class":"unknown","peer_ip_src":"127.0.0.1","peer_ip_dst":"","iface_in":0,"iface_out":0,"ip_src":"1.1.1.1","ip_dst":"2.2.2.2","port_src":9221,"port_dst":53,"tcp_flags":"0","ip_proto":"17","tos":0,"sampling_rate":0,"export_proto_seqno":1,"export_proto_version":5,"flows":1,"packets":222,"bytes":503,"flow_type":"NetFlow","event.volume.bytes":376}
14-August-2024 12 12:19:01.357 pm INFO {"tag":0,"class":"unknown","peer_ip_src":"127.0.0.1","peer_ip_dst":"","iface_in":0,"iface_out":0,"ip_src":"1.1.1.1","ip_dst":"2.2.2.2","port_src":40,"port_dst":443,"tcp_flags":"0","ip_proto":"6","tos":0,"sampling_rate":0,"export_proto_seqno":1,"export_proto_version":5,"flows":1,"packets":66,"bytes":651,"flow_type":"NetFlow","event.volume.bytes":373}
14-August-2024 12 12:19:01.358 pm INFO {"tag":0,"class":"unknown","peer_ip_src":"127.0.0.1","peer_ip_dst":"","iface_in":0,"iface_out":0,"ip_src":"1.1.1.1","ip_dst":"2.2.2.2","port_src":0,"port_dst":0,"tcp_flags":"0","ip_proto":"1","tos":0,"sampling_rate":0,"export_proto_seqno":1,"export_proto_version":5,"flows":1,"packets":118,"bytes":120,"flow_type":"NetFlow","event.volume.bytes":371}
14-August-2024 12 12:19:01.359 pm INFO {"tag":0,"class":"unknown","peer_ip_src":"127.0.0.1","peer_ip_dst":"","iface_in":0,"iface_out":0,"ip_src":"1.1.1.1","ip_dst":"2.2.2.2","port_src":9010,"port_dst":993,"tcp_flags":"0","ip_proto":"6","tos":0,"sampling_rate":0,"export_proto_seqno":1,"export_proto_version":5,"flows":1,"packets":984,"bytes":250,"flow_type":"NetFlow","event.volume.bytes":376}
14-August-2024 12 12:19:01.360 pm INFO {"tag":0,"class":"unknown","peer_ip_src":"127.0.0.1","peer_ip_dst":"","iface_in":0,"iface_out":0,"ip_src":"1.1.1.1","ip_dst":"2.2.2.2","port_src":40,"port_dst":123,"tcp_flags":"0","ip_proto":"17","tos":0,"sampling_rate":0,"export_proto_seqno":1,"export_proto_version":5,"flows":1,"packets":975,"bytes":205,"flow_type":"NetFlow","event.volume.bytes":375}
14-August-2024 12 12:19:01.361 pm INFO {"tag":0,"class":"unknown","peer_ip_src":"127.0.0.1","peer_ip_dst":"","iface_in":0,"iface_out":0,"ip_src":"1.1.1.1","ip_dst":"2.2.2.2","port_src":9010,"port_dst":3306,"tcp_flags":"0","ip_proto":"6","tos":0,"sampling_rate":0,"export_proto_seqno":1,"export_proto_version":5,"flows":1,"packets":372,"bytes":317,"flow_type":"NetFlow","event.volume.bytes":377}
14-August-2024 12 12:19:01.362 pm INFO {"tag":0,"class":"unknown","peer_ip_src":"127.0.0.1","peer_ip_dst":"","iface_in":0,"iface_out":0,"ip_src":"1.1.1.1","ip_dst":"2.2.2.2","port_src":40,"port_dst":80,"tcp_flags":"0","ip_proto":"6","tos":0,"sampling_rate":0,"export_proto_seqno":2,"export_proto_version":5,"flows":1,"packets":957,"bytes":495,"flow_type":"NetFlow","event.volume.bytes":373}
14-August-2024 12 12:19:01.363 pm INFO {"tag":0,"class":"unknown","peer_ip_src":"127.0.0.1","peer_ip_dst":"","iface_in":0,"iface_out":0,"ip_src":"1.1.1.1","ip_dst":"2.2.2.2","port_src":40,"port_dst":22,"tcp_flags":"0","ip_proto":"6","tos":0,"sampling_rate":0,"export_proto_seqno":1,"export_proto_version":5,"flows":1,"packets":679,"bytes":797,"flow_type":"NetFlow","event.volume.bytes":373}
14-August-2024 12 12:19:01.364 pm INFO {"tag":0,"class":"unknown","peer_ip_src":"127.0.0.1","peer_ip_dst":"","iface_in":0,"iface_out":0,"ip_src":"1.1.1.1","ip_dst":"2.2.2.2","port_src":40,"port_dst":161,"tcp_flags":"0","ip_proto":"17","tos":0,"sampling_rate":0,"export_proto_seqno":1,"export_proto_version":5,"flows":1,"packets":191,"bytes":887,"flow_type":"NetFlow","event.volume.bytes":375}
14-August-2024 12 12:19:01.365 pm INFO {"tag":0,"class":"unknown","peer_ip_src":"127.0.0.1","peer_ip_dst":"","iface_in":0,"iface_out":0,"ip_src":"1.1.1.1","ip_dst":"2.2.2.2","port_src":0,"port_dst":0,"tcp_flags":"0","ip_proto":"1","tos":0,"sampling_rate":0,"export_proto_seqno":2,"export_proto_version":5,"flows":1,"packets":118,"bytes":120,"flow_type":"NetFlow","event.volume.bytes":371}
14-August-2024 12 12:19:01.365 pm INFO {"tag":0,"class":"unknown","peer_ip_src":"127.0.0.1","peer_ip_dst":"","iface_in":0,"iface_out":0,"ip_src":"1.1.1.1","ip_dst":"2.2.2.2","port_src":40,"port_dst":443,"tcp_flags":"0","ip_proto":"6","tos":0,"sampling_rate":0,"export_proto_seqno":2,"export_proto_version":5,"flows":1,"packets":66,"bytes":651,"flow_type":"NetFlow","event.volume.bytes":373}
14-August-2024 12 12:19:01.366 pm INFO {"tag":0,"class":"unknown","peer_ip_src":"127.0.0.1","peer_ip_dst":"","iface_in":0,"iface_out":0,"ip_src":"1.1.1.1","ip_dst":"2.2.2.2","port_src":12001,"port_dst":8080,"tcp_flags":"0","ip_proto":"6","tos":0,"sampling_rate":0,"export_proto_seqno":2,"export_proto_version":5,"flows":1,"packets":54,"bytes":883,"flow_type":"NetFlow","event.volume.bytes":377}
14-August-2024 12 12:19:01.367 pm INFO {"tag":0,"class":"unknown","peer_ip_src":"127.0.0.1","peer_ip_dst":"","iface_in":0,"iface_out":0,"ip_src":"1.1.1.1","ip_dst":"2.2.2.2","port_src":9221,"port_dst":53,"tcp_flags":"0","ip_proto":"17","tos":0,"sampling_rate":0,"export_proto_seqno":2,"export_proto_version":5,"flows":1,"packets":222,"bytes":503,"flow_type":"NetFlow","event.volume.bytes":376}
14-August-2024 12 12:19:01.368 pm INFO {"tag":0,"class":"unknown","peer_ip_src":"127.0.0.1","peer_ip_dst":"","iface_in":0,"iface_out":0,"ip_src":"1.1.1.1","ip_dst":"2.2.2.2","port_src":40,"port_dst":22,"tcp_flags":"0","ip_proto":"6","tos":0,"sampling_rate":0,"export_proto_seqno":2,"export_proto_version":5,"flows":1,"packets":679,"bytes":797,"flow_type":"NetFlow","event.volume.bytes":373}
14-August-2024 12 12:19:01.368 pm INFO {"tag":0,"class":"unknown","peer_ip_src":"127.0.0.1","peer_ip_dst":"","iface_in":0,"iface_out":0,"ip_src":"1.1.1.1","ip_dst":"2.2.2.2","port_src":9010,"port_dst":993,"tcp_flags":"0","ip_proto":"6","tos":0,"sampling_rate":0,"export_proto_seqno":2,"export_proto_version":5,"flows":1,"packets":984,"bytes":250,"flow_type":"NetFlow","event.volume.bytes":376}
14-August-2024 12 12:19:01.369 pm INFO {"tag":0,"class":"unknown","peer_ip_src":"127.0.0.1","peer_ip_dst":"","iface_in":0,"iface_out":0,"ip_src":"1.1.1.1","ip_dst":"2.2.2.2","port_src":40,"port_dst":123,"tcp_flags":"0","ip_proto":"17","tos":0,"sampling_rate":0,"export_proto_seqno":2,"export_proto_version":5,"flows":1,"packets":975,"bytes":205,"flow_type":"NetFlow","event.volume.bytes":375}
14-August-2024 12 12:19:01.370 pm INFO {"tag":0,"class":"unknown","peer_ip_src":"127.0.0.1","peer_ip_dst":"","iface_in":0,"iface_out":0,"ip_src":"1.1.1.1","ip_dst":"2.2.2.2","port_src":40,"port_dst":80,"tcp_flags":"0","ip_proto":"6","tos":0,"sampling_rate":0,"export_proto_seqno":3,"export_proto_version":5,"flows":1,"packets":957,"bytes":495,"flow_type":"NetFlow","event.volume.bytes":373}
14-August-2024 12 12:19:01.370 pm INFO {"tag":0,"class":"unknown","peer_ip_src":"127.0.0.1","peer_ip_dst":"","iface_in":0,"iface_out":0,"ip_src":"1.1.1.1","ip_dst":"2.2.2.2","port_src":9010,"port_dst":3306,"tcp_flags":"0","ip_proto":"6","tos":0,"sampling_rate":0,"export_proto_seqno":2,"export_proto_version":5,"flows":1,"packets":372,"bytes":317,"flow_type":"NetFlow","event.volume.bytes":377}
14-August-2024 12 12:19:01.371 pm INFO {"tag":0,"class":"unknown","peer_ip_src":"127.0.0.1","peer_ip_dst":"","iface_in":0,"iface_out":0,"ip_src":"1.1.1.1","ip_dst":"2.2.2.2","port_src":12001,"port_dst":8080,"tcp_flags":"0","ip_proto":"6","tos":0,"sampling_rate":0,"export_proto_seqno":3,"export_proto_version":5,"flows":1,"packets":54,"bytes":883,"flow_type":"NetFlow","event.volume.bytes":377}
14-August-2024 12 12:19:01.372 pm INFO {"tag":0,"class":"unknown","peer_ip_src":"127.0.0.1","peer_ip_dst":"","iface_in":0,"iface_out":0,"ip_src":"1.1.1.1","ip_dst":"2.2.2.2","port_src":40,"port_dst":161,"tcp_flags":"0","ip_proto":"17","tos":0,"sampling_rate":0,"export_proto_seqno":2,"export_proto_version":5,"flows":1,"packets":191,"bytes":887,"flow_type":"NetFlow","event.volume.bytes":375}
14-August-2024 12 12:19:01.373 pm INFO {"tag":0,"class":"unknown","peer_ip_src":"127.0.0.1","peer_ip_dst":"","iface_in":0,"iface_out":0,"ip_src":"1.1.1.1","ip_dst":"2.2.2.2","port_src":0,"port_dst":0,"tcp_flags":"0","ip_proto":"1","tos":0,"sampling_rate":0,"export_proto_seqno":3,"export_proto_version":5,"flows":1,"packets":118,"bytes":120,"flow_type":"NetFlow","event.volume.bytes":371}
14-August-2024 12 12:19:01.374 pm INFO {"tag":0,"class":"unknown","peer_ip_src":"127.0.0.1","peer_ip_dst":"","iface_in":0,"iface_out":0,"ip_src":"1.1.1.1","ip_dst":"2.2.2.2","port_src":40,"port_dst":443,"tcp_flags":"0","ip_proto":"6","tos":0,"sampling_rate":0,"export_proto_seqno":3,"export_proto_version":5,"flows":1,"packets":66,"bytes":651,"flow_type":"NetFlow","event.volume.bytes":373}
14-August-2024 12 12:19:01.375 pm INFO {"tag":0,"class":"unknown","peer_ip_src":"127.0.0.1","peer_ip_dst":"","iface_in":0,"iface_out":0,"ip_src":"1.1.1.1","ip_dst":"2.2.2.2","port_src":9010,"port_dst":993,"tcp_flags":"0","ip_proto":"6","tos":0,"sampling_rate":0,"export_proto_seqno":3,"export_proto_version":5,"flows":1,"packets":984,"bytes":250,"flow_type":"NetFlow","event.volume.bytes":376}
14-August-2024 12 12:19:01.376 pm INFO {"tag":0,"class":"unknown","peer_ip_src":"127.0.0.1","peer_ip_dst":"","iface_in":0,"iface_out":0,"ip_src":"1.1.1.1","ip_dst":"2.2.2.2","port_src":9221,"port_dst":53,"tcp_flags":"0","ip_proto":"17","tos":0,"sampling_rate":0,"export_proto_seqno":3,"export_proto_version":5,"flows":1,"packets":222,"bytes":503,"flow_type":"NetFlow","event.volume.bytes":376}
14-August-2024 12 12:19:01.377 pm INFO {"tag":0,"class":"unknown","peer_ip_src":"127.0.0.1","peer_ip_dst":"","iface_in":0,"iface_out":0,"ip_src":"1.1.1.1","ip_dst":"2.2.2.2","port_src":40,"port_dst":22,"tcp_flags":"0","ip_proto":"6","tos":0,"sampling_rate":0,"export_proto_seqno":3,"export_proto_version":5,"flows":1,"packets":679,"bytes":797,"flow_type":"NetFlow","event.volume.bytes":373}
14-August-2024 12 12:19:01.377 pm INFO {"tag":0,"class":"unknown","peer_ip_src":"127.0.0.1","peer_ip_dst":"","iface_in":0,"iface_out":0,"ip_src":"1.1.1.1","ip_dst":"2.2.2.2","port_src":40,"port_dst":123,"tcp_flags":"0","ip_proto":"17","tos":0,"sampling_rate":0,"export_proto_seqno":3,"export_proto_version":5,"flows":1,"packets":975,"bytes":205,"flow_type":"NetFlow","event.volume.bytes":375}
14-August-2024 12 12:19:01.378 pm INFO {"tag":0,"class":"unknown","peer_ip_src":"127.0.0.1","peer_ip_dst":"","iface_in":0,"iface_out":0,"ip_src":"1.1.1.1","ip_dst":"2.2.2.2","port_src":40,"port_dst":80,"tcp_flags":"0","ip_proto":"6","tos":0,"sampling_rate":0,"export_proto_seqno":4,"export_proto_version":5,"flows":1,"packets":957,"bytes":495,"flow_type":"NetFlow","event.volume.bytes":373}
14-August-2024 12 12:19:01.379 pm INFO {"tag":0,"class":"unknown","peer_ip_src":"127.0.0.1","peer_ip_dst":"","iface_in":0,"iface_out":0,"ip_src":"1.1.1.1","ip_dst":"2.2.2.2","port_src":9010,"port_dst":3306,"tcp_flags":"0","ip_proto":"6","tos":0,"sampling_rate":0,"export_proto_seqno":3,"export_proto_version":5,"flows":1,"packets":372,"bytes":317,"flow_type":"NetFlow","event.volume.bytes":377}
```

I Observe that there is this field `export_proto_seqno` which is to use packet loss, not letting aggregate the flow.
so I removed the form conf file. but after that, I haven't received any flow to my collector.
(nfacctd.conf file is the same just removed export_proto_seqno from aggregate key)

I am sending 1000 flow but in logs, I am getting below logs
```
2024-08-14T12:48:48+05:30 INFO ( default/core ): waiting for NetFlow/IPFIX data on :::2055
2024-08-14T12:48:48+05:30 INFO ( NetFlow/print ): cache entries=16411 base cache memory=59210888 bytes
2024-08-14T12:48:48+05:30 INFO ( NetFlow/print ): JSON: setting object handlers.
2024-08-14T12:49:01+05:30 INFO ( NetFlow/print ): *** Purging cache - START (PID: 25875) ***
2024-08-14T12:49:01+05:30 INFO ( NetFlow/print ): *** Purging cache - END (PID: 25875, QN: 0/0, ET: X) ***
2024-08-14T12:50:01+05:30 INFO ( NetFlow/print ): *** Purging cache - START (PID: 25887) ***
2024-08-14T12:50:01+05:30 INFO ( NetFlow/print ): *** Purging cache - END (PID: 25887, QN: 0/0, ET: X) ***
2024-08-14T12:51:01+05:30 INFO ( NetFlow/print ): *** Purging cache - START (PID: 25921) ***
2024-08-14T12:51:01+05:30 INFO ( NetFlow/print ): *** Purging cache - END (PID: 25921, QN: 0/0, ET: X) ***
2024-08-14T12:52:01+05:30 INFO ( NetFlow/print ): *** Purging cache - START (PID: 25935) ***
2024-08-14T12:52:01+05:30 INFO ( NetFlow/print ): *** Purging cache - END (PID: 25935, QN: 0/0, ET: X) ***
2024-08-14T12:53:01+05:30 INFO ( NetFlow/print ): *** Purging cache - START (PID: 25943) ***
2024-08-14T12:53:01+05:30 INFO ( NetFlow/print ): *** Purging cache - END (PID: 25943, QN: 0/0, ET: X) ***
2024-08-14T12:54:01+05:30 INFO ( NetFlow/print ): *** Purging cache - START (PID: 26151) ***
2024-08-14T12:54:01+05:30 INFO ( NetFlow/print ): *** Purging cache - END (PID: 26151, QN: 10/10, ET: 0) ***
2024-08-14T12:55:01+05:30 INFO ( NetFlow/print ): *** Purging cache - START (PID: 26157) ***
2024-08-14T12:55:01+05:30 INFO ( NetFlow/print ): *** Purging cache - END (PID: 26157, QN: 0/0, ET: X) ***
```
is this the right way, or am I missing something, please let me know.

Thanks,
Smit

**Comment by paololucente** [comment]
Removing `export_proto_seqno` (and maybe also `export_proto_version`) was the additional right thing to do. You did actually receive some flows (10), ie.:

```
2024-08-14T12:54:01+05:30 INFO ( NetFlow/print ): *** Purging cache - START (PID: 26151) ***
2024-08-14T12:54:01+05:30 INFO ( NetFlow/print ): *** Purging cache - END (PID: 26151, QN: 10/10, ET: 0) ***
```

Do you not see these? 

Paolo

**Comment by smit1682** [comment]
hello paolo,
 It worked as you suggested, we removed timestamp-related fields and eport_proto_vertion field from .conf file.
 
 thank you so much.
